{
  "$schema": "./current-work.schema.json",
  "schema_version": "1.0",
  "status": "completed",
  "selected_at": "2026-10-12T19:33:22Z",
  "updated_at": "2026-10-12T19:55:40Z",
  "roadmap_basis": [
    {
      "path": "memoria-bootstrap/docs/roadmap/02-technical-roadmap.md",
      "section": "T41 - Calibrazione OCR su campione reale stratificato",
      "reason": "T41 dispone di un candidato visivo non verificato per 00750; la roadmap richiede reference umane page-scoped e il campione resta sotto le 8-10 pagine iniziali."
    }
  ],
  "increment": {
    "id": "t41-human-review-00750-20261012",
    "title": "T41 trascrizione visuale assistita 00750",
    "objective": "Produrre una trascrizione candidata dei valori della pagina 00750 dopo controllo visuale dell'originale e proseguire senza richieste manuali dove l'immagine risolve i dubbi.",
    "scope": [
      "Verify the source TIFF identity against the pinned SHA-256 and inspect the existing 00750 review preview and visual candidate.",
      "Resolve the candidate text and table values against full-resolution TIFF crops and existing PP-OCRv5 evidence.",
      "Write a new external model-assisted transcription candidate with image/OCR provenance, resolved variants, and an unresolved-item count.",
      "Document the low-manual-review procedure and select page 01000 as the next image after this micro-increment."
    ],
    "out_of_scope": [
      "Treat model visual reading, OCR output, or lexical plausibility as human confirmation or verified gold.",
      "Modify source TIFF, raw OCR/evidence, existing structure, lexicon review, run manifests, or review queue.",
      "Create or promote a verified reference, change holdout membership, or derive a general threshold."
    ],
    "candidate_files": [
      "D:\\CaDiMalanca\\me.mo.ri.a-kb-runtime\\ocr-runs\\t41-00750-ocr-structure-20261006\\review-preview-00750-20261011.md",
      "D:\\CaDiMalanca\\me.mo.ri.a-kb-runtime\\ocr-runs\\t41-00750-ocr-structure-20261006\\visual-review-candidate-00750-20261011.json",
      "new external model-assisted candidate transcription for page 00750",
      "P:\\Comune\\Me.Mo.Ri.a\\documenti_da_processare\\foto\\T314 R1275\\T314-1275-00750.tif"
    ],
    "stop_condition": "A provenance-bound transcription candidate records all table values, source/OCR digests, and zero unresolved visual questions; it remains unverified, with no metric or gold-set update."
  },
  "verification": {
    "tests": [
      "Check source and input digests, candidate transcript completeness, zero unresolved visual questions, no source/OCR/queue mutation; run routing validator and git diff --check.",
      "memoria-engine/.venv/Scripts/python.exe memoria-bootstrap/planning/validate-codex-model-routing.py; git diff --check"
    ],
    "documentation_touchpoints": [
      "memoria-bootstrap/docs/current-next-increment.md",
      "memoria-bootstrap/docs/playbooks/codex-document-analysis-core.md",
      "memoria-bootstrap/planning/current-work.json"
    ],
    "result": "passed",
    "notes": "Source TIFF and pinned sidecar/evidence hashes verified. Transcribed 22 numeric pairs and four notes from full-page and enlarged crops; prior `tl.[5/6]18` ambiguity resolves visually to `tl.618`, leaving zero visual unresolved items. External sidecar visual-review-candidate-00750-20261012.md SHA-256 8b8010b49a46d1d97294c935eeac4a29aa1ce8bf6ae9ac919b55bd7e4dc7fb29. The candidate remains unverified; TIFF, OCR, queue, and gold inventory unchanged. Playbook now records the unresolved-only review procedure. Next candidate page: 01000, resume from existing checkpoint.",
    "task_envelope": {
      "mode": "scoped-fix",
      "repositories": [
        "external-runtime",
        "memoria-bootstrap"
      ],
      "read_set": [
        "AGENTS.md",
        "runtime/t41-00750-ocr-structure-20261006/review-preview-00750-20261011.md",
        "runtime/t41-00750-ocr-structure-20261006/visual-review-candidate-00750-20261011.json",
        "source TIFF T314-1275-00750.tif",
        "memoria-bootstrap/docs/current-next-increment.md#T41"
      ],
      "write_set": [
        "runtime/t41-00750-ocr-structure-20261006/visual-review-candidate-00750-20261012.md",
        "memoria-bootstrap/docs/current-next-increment.md",
        "memoria-bootstrap/planning/current-work.json"
      ],
      "test_command": "Verify source/input/output hashes, all table-value rows, unresolved count, and unchanged TIFF/OCR/queue; run routing validator and git diff --check",
      "stop_conditions": [
        "All table values are transcribed and the visual unresolved-item count is zero.",
        "Source TIFF, raw OCR/evidence, and review queue remain unchanged.",
        "The candidate remains excluded from verified gold and metrics until the separate human-reference contract passes."
      ]
    }
  },
  "routing": {
    "policy_version": "3.0",
    "tier": "low",
    "task_class": "documentation",
    "agent": "mmr_docs_editor",
    "model": "gpt-6-luna",
    "reasoning_effort": "low",
    "rationale": "Document and apply a low-manual-review visual transcription procedure to one page; only create an unverified candidate and advance the next image handoff.",
    "trace": [
      {
        "event": "selected",
        "at": "2026-10-12T19:33:22Z",
        "tier": "low",
        "agent": "mmr_docs_editor",
        "model": "gpt-6-luna",
        "reasoning_effort": "low",
        "reason": "Select a single-page model-assisted transcription and document the unresolved-only review procedure; no reference promotion is in scope."
      },
      {
        "event": "completed",
        "at": "2026-10-12T19:55:40Z",
        "tier": "low",
        "agent": "mmr_docs_editor",
        "model": "gpt-6-luna",
        "reasoning_effort": "low",
        "reason": "Saved a hash-bound, unverified 00750 transcript with 22 value pairs and zero unresolved visual items; documented the low-manual-review procedure and handed off to 01000."
      },
      {
        "event": "completed",
        "at": "2026-10-11T19:39:33Z",
        "tier": "low",
        "agent": "mmr_docs_editor",
        "model": "gpt-6-luna",
        "reasoning_effort": "low",
        "reason": "Closed the session by recording the reusable visual-review and user-confirmation workflow in the document-analysis playbook."
      },
      {
        "event": "selected",
        "at": "2026-10-11T19:36:00Z",
        "tier": "low",
        "agent": "mmr_docs_editor",
        "model": "gpt-6-luna",
        "reasoning_effort": "low",
        "reason": "Save session learnings about automated visual checks and precise human review prompts; close without opening another increment."
      },
      {
        "event": "completed",
        "at": "2026-10-11T19:35:47Z",
        "tier": "medium",
        "agent": "mmr_implementer",
        "model": "gpt-6.1-sol",
        "reasoning_effort": "medium",
        "reason": "Persisted and validated the comparison-only normalization diagnostic; L+D reduced descriptive flags 166 to 157, but changed token segmentation and left 7 shared-error misses, so no queue policy or threshold follows."
      },
      {
        "event": "selected",
        "at": "2026-10-11T19:30:16Z",
        "tier": "medium",
        "agent": "mmr_implementer",
        "model": "gpt-6.1-sol",
        "reasoning_effort": "medium",
        "reason": "Quantify comparison-only normalization variants against the pinned T41 gold to test whether format noise explains unnecessary OCR-visual flags."
      },
      {
        "event": "delegated",
        "at": "2026-10-11T19:30:16Z",
        "tier": "medium",
        "agent": "mmr_implementer",
        "model": "gpt-6.1-sol",
        "reasoning_effort": "medium",
        "reason": "Independently compute read-only normalization variants; no writes to references, OCR, queue, or runtime artifacts."
      },
      {
        "event": "completed",
        "at": "2026-10-11T19:27:00Z",
        "tier": "medium",
        "agent": "mmr_implementer",
        "model": "gpt-6.1-sol",
        "reasoning_effort": "medium",
        "reason": "Persisted and independently reproduced the token-level disagreement workload; 27.71% review precision and 86.79% PP-OCRv5-error recall do not support safe queue reduction or auto-acceptance."
      },
      {
        "event": "delegated",
        "at": "2026-10-11T18:44:00Z",
        "tier": "medium",
        "agent": "mmr_implementer",
        "model": "gpt-6.1-sol",
        "reasoning_effort": "medium",
        "reason": "Independently align PP-OCRv5 and blind visual outputs to the pinned gold references and quantify candidate review workload."
      },
      {
        "event": "selected",
        "at": "2026-10-11T18:43:00Z",
        "tier": "medium",
        "agent": "mmr_implementer",
        "model": "gpt-6.1-sol",
        "reasoning_effort": "medium",
        "reason": "Measure reference-aligned OCR/visual disagreement workload and its ability to surface PP-OCRv5 errors without automating review decisions."
      },
      {
        "event": "completed",
        "at": "2026-10-11T18:39:00Z",
        "tier": "medium",
        "agent": "mmr_implementer",
        "model": "gpt-6.1-sol",
        "reasoning_effort": "medium",
        "reason": "Persisted blind image-only transcripts and deterministic page-scoped comparison; PP-OCRv5 wins on two pages, so no threshold or automatic acceptance follows."
      },
      {
        "event": "completed",
        "at": "2026-10-11T16:20:00Z",
        "tier": "medium",
        "agent": "mmr_implementer",
        "model": "gpt-6.1-sol",
        "reasoning_effort": "medium",
        "reason": "Persisted the model-assisted visual candidate with pinned hashes and explicit limitations; focused Tesseract crops remained diagnostic and the page is not counted as human gold."
      },
      {
        "event": "selected",
        "at": "2026-10-11T14:07:01Z",
        "tier": "medium",